{
  "schema_version": "2026-05-29",
  "document_type": "user_preferences",
  "tenant_id": "tenant_demo",
  "user_id": "owner@example.com",
  "theme": "system",
  "default_stripe_mode": "test",
  "sidebar_collapsed": false,
  "dashboard_home": "dashboard",
  "landing_pages": {
    "default_template_id": "socialite",
    "custom_color_themes": []
  },
  "authoring_defaults": {
    "return_address": {
      "instructions": "",
      "updated_at": 1780092000
    },
    "refund_request_handling": {
      "mode": "manual_review",
      "sms_notifications": {
        "enabled": false,
        "phone_number": "+12065654418"
      }
    }
  },
  "updated_at": 1780092000
}
